{
  "review_trigger_id": "AKTA-REVTRIG-DEMO0001",
  "decision_id": "AKTA-DEC-DEMO0002",
  "source_record_id": "AKTA-SAR-DEMO0002",
  "requested_tool": "experiment_planner.create_run_plan",
  "requested_action": "create_run_plan",
  "deployment_profile": "P5_review_gated_experimental_planner",
  "scientific_action_type": "A6_experimental_planning",
  "responsibility_level": "R5_experimental_planning",
  "evidence_state": "E5_internally_replicated_evidence",
  "validation_status": "V4_internally_replicated",
  "verification_status": "Q0_unchecked",
  "admissibility": "review_required",
  "decision_reason": "Profile P5_review_gated_experimental_planner matrix decision for A6_experimental_planning is review_required. Evidence rule E5_internally_replicated_evidence+A6_experimental_planning constrains to review_required (resolved from review_required).",
  "required_review_role": "domain_scientist",
  "review_scope": "experimental_plan_review",
  "review_artifacts_required": [
    "ai_output",
    "akta_record",
    "protocol_diff",
    "evidence_state",
    "validation_status",
    "blocked_tools",
    "next_admissible_steps"
  ],
  "blocked_tools": [
    "experiment_planner.create_run_plan"
  ],
  "allowed_next_steps": [],
  "approval_effect": "Allows scoped next step only; not global permission.",
  "default_expiration": "single_run",
  "policy_hash": "sha256:0430016c6b03d5ab038208784ba502d00e6c7b7e344fcea0e4c6a4cedef1809f",
  "tool_registry_hash": "sha256:d4a9e0330c43ee6661a9248fde0b2f452be22bbc95179c2fc96e2f4e3cc14b40",
  "classifier_confidence": 0.98,
  "classification_rationale": "tool registry maps experiment_planner.create_run_plan to A6_experimental_planning",
  "consequentiality": true,
  "consequentiality_reason": "action type A6_experimental_planning",
  "scientific_context": {
    "domain": "materials",
    "project_id": null,
    "system_id": "example_agent"
  },
  "review_trigger_hash": "sha256:461aa83bd68ff5af832cf1522cb23d863899316e3a2a1e27bd7895e0695aa450"
}